{
  "schema_version": 2,
  "record_id": "synthesis-1",
  "pass_id": "example-pass",
  "target_path": "reviews/examples/artifacts/target.valid.md",
  "target_revision": "git:73eaed921475be235f6684abdd2ce19a4e367c7f",
  "included_review_record_ids": [
    "review-implementation-1"
  ],
  "superseded_review_record_ids": [],
  "finding_decisions": [
    {
      "finding_id": "no-material-blockers",
      "source_lens": "implementation",
      "source_review_record_id": "review-implementation-1",
      "decision": "accepted",
      "severity": "minor",
      "affects_rerun_scope": false,
      "reason": "Review found no material blocker."
    }
  ],
  "lens_lock_decisions": [
    {
      "lens": "implementation",
      "lens_state": "settled",
      "reason": "Validated review delivered with no blocking gaps."
    }
  ],
  "final_assessment": "Ready to implement",
  "scope_delta": {
    "added": [],
    "removed": [],
    "net": "unchanged",
    "reductive_goal": false
  },
  "artifact_path": "reviews/examples/synthesis-output.valid.json",
  "markdown_artifact_path": "reviews/examples/artifacts/synthesis-output.valid.md",
  "markdown_artifact_sha": "git:22abdd6e78e12c41a2db0caba98d650f14fcd864",
  "run_mode": "full",
  "claim_flags": {
    "completion": false,
    "lock_state": false,
    "all_5_lockable": false,
    "review_complete": false
  },
  "prior_material_findings_context": [],
  "review_input_revision": "sha256:dc29a2b9712d8555b2b607998bd97d25cc3a61dbc0e447dd8dee1865a6c3833d"
}
